{
  "blocking_recall": 0.99,
  "fingerprint": {
    "cgroup_cpu_max": "2.0",
    "cgroup_memory_max": 6442450944,
    "cgroup_memory_peak": 104857600,
    "config_hash": "0000000000000000",
    "dbt_core_version": "1.12.2",
    "dbt_duckdb_version": "1.11.0",
    "duckdb_version": "1.5.5",
    "ducklake_extension_version": "0.3",
    "er_duckdb_memory_limit": "4GB",
    "er_duckdb_threads": 2,
    "generator_seed": 42,
    "git_sha": "0000000",
    "image_digest": "sha256:baseline",
    "model_version": "v0001",
    "nproc": 8,
    "runner": "ubuntu-latest",
    "scale": "smoke",
    "splink_version": "4.0.16",
    "tf_snapshot_id": "01SNAP"
  },
  "incremental_ratio": 0.5,
  "memory": {
    "cgroup_peak_bytes": 104857600,
    "duckdb_buffer_peak_bytes": 52428800,
    "rss_peak_bytes": 83886080
  },
  "phases": [
    {
      "candidate_pair_count": 10,
      "memory_peak_bytes": 104857600,
      "name": "ingest",
      "pairs_above_auto_merge": 3,
      "records_per_sec": 500.0,
      "snapshot_count": 2,
      "wall_ms": 120.0,
      "wall_ms_cv": 0.05
    },
    {
      "candidate_pair_count": 10,
      "memory_peak_bytes": 104857600,
      "name": "standardize",
      "pairs_above_auto_merge": 3,
      "records_per_sec": 500.0,
      "snapshot_count": 2,
      "wall_ms": 80.0,
      "wall_ms_cv": 0.05
    },
    {
      "candidate_pair_count": 10,
      "memory_peak_bytes": 104857600,
      "name": "train",
      "pairs_above_auto_merge": 3,
      "records_per_sec": 500.0,
      "snapshot_count": 2,
      "wall_ms": 900.0,
      "wall_ms_cv": 0.05
    },
    {
      "candidate_pair_count": 10,
      "memory_peak_bytes": 104857600,
      "name": "full_match_reconcile",
      "pairs_above_auto_merge": 3,
      "records_per_sec": 500.0,
      "snapshot_count": 2,
      "wall_ms": 600.0,
      "wall_ms_cv": 0.05
    },
    {
      "candidate_pair_count": 10,
      "memory_peak_bytes": 104857600,
      "name": "assemble",
      "pairs_above_auto_merge": 3,
      "records_per_sec": 500.0,
      "snapshot_count": 2,
      "wall_ms": 300.0,
      "wall_ms_cv": 0.05
    },
    {
      "candidate_pair_count": 10,
      "memory_peak_bytes": 104857600,
      "name": "incremental_cycle",
      "pairs_above_auto_merge": 3,
      "records_per_sec": 500.0,
      "snapshot_count": 2,
      "wall_ms": 400.0,
      "wall_ms_cv": 0.05
    }
  ],
  "quality": {
    "cluster_f1": 0.985,
    "cluster_precision": 1.0,
    "cluster_recall": 0.97,
    "edge_f1": 0.99,
    "edge_precision": 1.0,
    "edge_recall": 0.98
  },
  "repeat": 3,
  "scale": "smoke",
  "verdict": "NO_BASELINE"
}
